{
  "schemaVersion": "SkillIntentV1",
  "skillId": "evolution-governance",
  "intents": [
    {
      "id": "primary",
      "label": "自我进化治理能力",
      "include": [
        "Prompt",
        "evolution",
        "governance"
      ]
    }
  ],
  "examples": {
    "positive": [
      "自我进化治理能力领域任务",
      "自我进化治理能力专项审查"
    ],
    "negative": [
      "无关闲聊或通用问答",
      "由其他领域 Skill 明确负责的任务"
    ]
  },
  "summary": "自我进化治理能力 — 规范、Skill、Prompt、探针和发布流程自动优化的控制面门禁"
}
