{
  "schemaVersion": "SkillIntentV1",
  "skillId": "spec-absorption",
  "intents": [
    {
      "id": "primary",
      "label": "规范吸纳执行 Skill",
      "include": [
        "data",
        "spec-absorption",
        "spec",
        "absorption"
      ]
    }
  ],
  "examples": {
    "positive": [
      "规范吸纳执行 Skill领域任务",
      "规范吸纳执行 Skill专项审查"
    ],
    "negative": [
      "无关闲聊或通用问答",
      "由其他领域 Skill 明确负责的任务"
    ]
  },
  "summary": "规范吸纳执行 Skill — 用于检查 data 最新可吸纳项、证明通用规范价值、剔除项目独有规则、输出吸纳清单、分层决策、同步消费者和验证探针；当用户说“吸纳规范 / 最新可吸纳 / 仍需吸纳 / 检查 data 是否有规范 / 开始吸纳”时使用。"
}
